### ISSUE TITLE
Upstream DNS resolution failure

### ISSUE THREAD

**Issue by rinseaid** [fosrl/apple#4]
### Describe the Bug

When setting an upstream DNS server in the Pangolin client that is a private IP address, which is reachable from the client device (via Pangolin tunnel itself), all DNS requests fail. 

A Private Resource is configured specifically to the internal DNS server (192.168.5.3).

For example, nslookup using Pangolin 'Magic DNS':
````
nslookup test.internal.domain.com
Server:		100.96.128.1
Address:	100.96.128.1#53

Non-authoritative answer:
*** Can't find test.internal.domain.com: No answer
````

nslookup to the upstream DNS server:
````
$ nslookup test.internal.domain.com 192.168.5.3
Server:		192.168.5.3
Address:	192.168.5.3#53

Name:	test.internal.domain.com
Address: 192.168.1.2
````

Output from ```log stream --predicate 'subsystem == "net.pangolin.Pangolin" OR subsystem == "net.pangolin.Pangolin.PacketTunnel"' --level debug --style compact```

````
2025-12-13 16:18:27.657 Db net.pangolin.Pangolin.PacketTunnel[13124:1cb41a] [net.pangolin.Pangolin.PacketTunnel:PangolinGo] No local record for www.apple.com., forwarding upstream to [192.168.5.3:53]
2025-12-13 16:18:27.657 Db net.pangolin.Pangolin.PacketTunnel[13124:1cb416] [net.pangolin.Pangolin.PacketTunnel:PangolinGo] DNS query for www.google.com. (type A)
2025-12-13 16:18:27.657 Db net.pangolin.Pangolin.PacketTunnel[13124:1cb416] [net.pangolin.Pangolin.PacketTunnel:PangolinGo] No local record for www.google.com., forwarding upstream to [192.168.5.3:53]
2025-12-13 16:18:27.657 Db net.pangolin.Pangolin.PacketTunnel[13124:1cb41a] [net.pangolin.Pangolin.PacketTunnel:PangolinGo] DNS query for apple.com. (type A)
2025-12-13 16:18:27.657 Db net.pangolin.Pangolin.PacketTunnel[13124:1cb416] [net.pangolin.Pangolin.PacketTunnel:PangolinGo] DNS query for api.apple-cloudkit.com. (type A)
2025-12-13 16:18:27.657 Db net.pangolin.Pangolin.PacketTunnel[13124:1cb416] [net.pangolin.Pangolin.PacketTunnel:PangolinGo] No local record for api.apple-cloudkit.com., forwarding upstream to [192.168.5.3:53]
2025-12-13 16:18:27.657 Db net.pangolin.Pangolin.PacketTunnel[13124:1cb41a] [net.pangolin.Pangolin.PacketTunnel:PangolinGo] No local record for apple.com., forwarding upstream to [192.168.5.3:53]
2025-12-13 16:18:27.658 Db net.pangolin.Pangolin.PacketTunnel[13124:1cb41b] [net.pangolin.Pangolin.PacketTunnel:PangolinGo] DNS query for 1-courier.push.apple.com. (type A)
2025-12-13 16:18:27.658 Db net.pangolin.Pangolin.PacketTunnel[13124:1cb41b] [net.pangolin.Pangolin.PacketTunnel:PangolinGo] No local record for 1-courier.push.apple.com., forwarding upstream to [192.168.5.3:53]
2025-12-13 16:18:27.658 Db net.pangolin.Pangolin.PacketTunnel[13124:1cb40f] [net.pangolin.Pangolin.PacketTunnel:PangolinGo] DNS query for test.internal.domain.com. (type A)
....
2025-12-13 16:18:28.532 E  net.pangolin.Pangolin.PacketTunnel[13124:1cb41b] [net.pangolin.Pangolin.PacketTunnel:PangolinGo] Failed to get DNS response for www.apple.com.
2025-12-13 16:18:28.533 E  net.pangolin.Pangolin.PacketTunnel[13124:1cb416] [net.pangolin.Pangolin.PacketTunnel:PangolinGo] Failed to get DNS response for www.google.com.
2025-12-13 16:18:28.533 E  net.pangolin.Pangolin.PacketTunnel[13124:1cb40f] [net.pangolin.Pangolin.PacketTunnel:PangolinGo] Failed to get DNS response for apple.com.
2025-12-13 16:18:28.534 E  net.pangolin.Pangolin.PacketTunnel[13124:1cb41b] [net.pangolin.Pangolin.PacketTunnel:PangolinGo] Failed to get DNS response for api.apple-cloudkit.com.
2025-12-13 16:18:28.534 E  net.pangolin.Pangolin.PacketTunnel[13124:1cb416] [net.pangolin.Pangolin.PacketTunnel:PangolinGo] Failed to get DNS response for 1-courier.push.apple.com.
2025-12-13 16:18:28.535 E  net.pangolin.Pangolin.PacketTunnel[13124:1cb40f] [net.pangolin.Pangolin.PacketTunnel:PangolinGo] Failed to get DNS response for test.internal.domain.com.
````

### Environment

- OS Type & Version: (e.g., Ubuntu 22.04) macOS 26.1, Pangolin backend running on Flatcar Linux 4459.2.1 on VPS.
- Pangolin Version: 1.13.0
- Gerbil Version: 1.3.0
- Traefik Version: 3.5
- Newt Version: 1.7.0
- Client Version: (if applicable) 0.1.1

### To Reproduce

Set the Upstream DNS setting in the Pangolin client to the private IP address of a DNS server reachable from the Newt connector.
Attempt to resolve any DNS request.

### Expected Behavior

DNS requests should be resolved.

**Comment by rinseaid** [comment]
@oschwartz10612 this now seems to be working. I don't know what I did or changed - certainly nothing intentionally. But I enabled Upstream DNS again and it's functioning without issue now!

**Comment by rinseaid** [comment]
It looks like I confused myself, as I had created a private resource for a specific host I was trying to reach, which allowed the DNS resolution to work - but I didn't realize it was resolving to the overlay IP.

This issue still exists. If I'm misunderstanding how this is intended to work please let me know, but in my mind I expect this to function similarly to Tailscale, where I can designate a private DNS server reachable over the Pangolin client tunnel to resolve resources within my private resource network CIDR. Side note, it would be great to be able to designate specific domains to send to this DNS server (e.g. the Split nameserver function in Tailscale).

**Comment by rinseaid** [comment]
Here are the results, running ```sudo tcpdump -n -s 1500 -i any udp and port 53 | grep internal.domain.com```

The client's 'real' private IP is ```192.168.0.21```, and the upstream DNS server configured in Pangolin client is ```192.168.5.3```. 

````
14:42:42.728414 IP 100.90.128.5.52263 > 100.96.128.1.53: 50235+ A? test.internal.domain.com. (46)
14:42:42.729351 IP 192.168.0.21.54409 > 192.168.5.3.53: 50235+ A? test.internal.domain.com. (46)
14:42:47.732975 IP 100.90.128.5.52263 > 100.96.128.1.53: 50235+ A? test.internal.domain.com. (46)
14:42:47.734792 IP 192.168.0.21.49194 > 192.168.5.3.53: 50235+ A? test.internal.domain.com. (46)
14:42:51.327665 IP 100.90.128.5.51813 > 100.96.128.1.53: 54464+ A? test2.internal.domain.com. (46)
14:42:51.328669 IP 192.168.0.21.54280 > 192.168.5.3.53: 54464+ A? test2.internal.domain.com. (46)
14:42:56.332035 IP 100.90.128.5.51813 > 100.96.128.1.53: 54464+ A? test2.internal.domain.com. (46)
14:42:56.334152 IP 192.168.0.21.50745 > 192.168.5.3.53: 54464+ A? test2.internal.domain.com. (46)
14:43:01.335685 IP 100.90.128.5.51813 > 100.96.128.1.53: 54464+ A? test2.internal.domain.com. (46)
14:43:01.337911 IP 192.168.0.21.50889 > 192.168.5.3.53: 54464+ A? test2.internal.domain.com. (46)
````

As you suggested, it does indeed appear that the request is attempting to reach the upstream DNS server directly, outside of the tunnel. I assume the requests making their way to the Pangolin overlay gateway (100.96.128.1) are attempts to resolve the 'alias' DNS names configured in Pangolin. Note that those do resolve correctly, and the tcpdump shows that those requests are only sent to the Pangolin overlay gateway:

```14:48:29.942620 IP 100.90.128.5.53332 > 100.96.128.1.53: 45073+ A? alias.internal.pangolin.com. (37)```

Please let me know if there's any other logging that might be useful. Thanks!

**Comment by oschwartz10612** [comment]
This is great thank you! I will think of a way to make this work at some 
point! :}

**Comment by oschwartz10612** [comment]
Closed by: c175c3597575b3f6fe40d0463c3ec699cc9c5d3d

Should be fixed in the next release using the tunnel dns option from olm in https://github.com/fosrl/olm/pull/64
